{
  "$schema": "https://json-schema.org/draft/2020-12/schema",
  "$id": "dependency-graph-schema-v1.0",
  "$comment": "TEMPLATE for dependency-graph.json. Produced by L1-planning-dependency-mapper (Core), evaluated by L1-planning-dependency-mapper-evaluator. Consumes impact-assessment.md + prd.md (prd.md composes requirements.md + nfr-spec.md — see prd.template.md). Consumed by L1-planning-backlog-prioritizer (topological-sort input) and L1-design-hld (Phase 4). This is a structural schema — it validates shape, not acyclicity. Acyclicity is a separate, mandatory check (gr-L1-output-schema-validator hard-fails and escalates to HITL on any detected cycle; this cannot be expressed as a JSON Schema constraint alone, so the mapper agent must run an explicit cycle-detection pass and report the result in cycle_check below).",
  "title": "DependencyGraph",
  "type": "object",
  "required": ["product_name", "source_artifacts", "nodes", "edges", "cycle_check", "critical_path", "generated", "execution_id", "workflow_execution_id"],
  "properties": {
    "product_name": { "type": "string" },
    "source_artifacts": {
      "type": "object",
      "required": ["impact_assessment", "prd"],
      "properties": {
        "impact_assessment": { "type": "string", "description": "artifact id of impact-assessment.md consumed" },
        "prd": { "type": "string", "description": "artifact id of prd.md consumed" }
      }
    },
    "nodes": {
      "type": "array",
      "minItems": 1,
      "items": {
        "type": "object",
        "required": ["id", "type", "label"],
        "properties": {
          "id": { "type": "string", "pattern": "^[a-z0-9-]+$" },
          "type": {
            "type": "string",
            "enum": ["component", "external-dependency"],
            "description": "component = new/existing system to be built; external-dependency = a real prerequisite outside the build (partner, vendor) — not the same as an org-internal existing system"
          },
          "label": { "type": "string" },
          "source_requirement": {
            "type": "array",
            "items": { "type": "string", "pattern": "^FR-[0-9]{3}$" },
            "minItems": 1,
            "description": "All FR-NNN ids this node traces back to, if it's a component derived from impact-assessment.md. Use an array even for one FR — a node satisfying multiple requirements (e.g. one reporting component covering two metrics) must list all of them, not just the first."
          }
        }
      }
    },
    "edges": {
      "type": "array",
      "items": {
        "type": "object",
        "required": ["from", "to", "type"],
        "properties": {
          "from": { "type": "string", "description": "node id" },
          "to": { "type": "string", "description": "node id" },
          "type": {
            "type": "string",
            "enum": ["depends-on", "blocks", "integrates-with"],
            "description": "Direction is UNIFORM across all three types: 'from' is always the upstream/prerequisite node and 'to' is always the downstream/dependent node — i.e. 'from' must exist/complete before 'to' can proceed. depends-on = hard technical prerequisite between two components (edge: prerequisite -> dependent, e.g. identity-verification-service -> verification-confidence-limit-engine, read as \"verification-confidence-limit-engine depends on identity-verification-service\" even though the arrow points the other way); blocks = an external-dependency node gating a component (edge: blocker -> blocked); integrates-with = non-blocking peer integration (edge: producer -> consumer; failure of 'to' does not halt 'from'). Do not mix directions within a type — every edge, regardless of type, follows prerequisite -> dependent so topological sort and critical-path traversal work with a single consistent forward walk."
          }
        }
      }
    },
    "cycle_check": {
      "type": "object",
      "required": ["status", "cycles_found"],
      "properties": {
        "status": { "type": "string", "enum": ["PASS", "FAIL"] },
        "cycles_found": {
          "type": "array",
          "items": { "type": "array", "items": { "type": "string" } },
          "description": "empty array if status is PASS; each inner array is the node-id sequence forming a cycle if FAIL"
        }
      }
    },
    "critical_path": {
      "type": "object",
      "required": ["nodes", "rationale"],
      "properties": {
        "nodes": { "type": "array", "items": { "type": "string" }, "description": "ordered node ids forming the longest blocking (depends-on/blocks) chain — integrates-with edges are excluded since they're non-blocking" },
        "rationale": { "type": "string" }
      }
    },
    "generated": { "type": "string", "format": "date" },
    "execution_id": { "type": "string" },
    "workflow_execution_id": { "type": "string" }
  }
}
