{
  "product_name": "HarvestLink",
  "source_artifacts": {
    "impact_assessment": "impact-assessment-2026-08-05-002",
    "prd": "prd-2026-08-05-002"
  },
  "nodes": [
    { "id": "legal-structure-validation", "type": "external-dependency", "label": "Legal/regulatory design-partner validation of facilitation-only structure" },
    { "id": "compliance-completeness-methodology", "type": "external-dependency", "label": "Compliance-documentation-completeness scoring methodology" },
    { "id": "external-identity-provider", "type": "external-dependency", "label": "External identity provider for producers/distributors/buyers (Thornbury Group Azure AD is employee-only — kb-L1-enterprise-security ES1)" },
    { "id": "onboarding-attestation-service", "type": "component", "label": "Onboarding Attestation Service", "source_requirement": ["FR-001"] },
    { "id": "buyer-discovery-matching-service", "type": "component", "label": "Buyer Discovery & Matching Service", "source_requirement": ["FR-002"] },
    { "id": "traceability-record-service", "type": "component", "label": "Traceability Record Service", "source_requirement": ["FR-003"] },
    { "id": "allergen-declaration-service", "type": "component", "label": "Allergen Declaration Service", "source_requirement": ["FR-004"] },
    { "id": "compliance-completeness-limit-engine", "type": "component", "label": "Compliance-Completeness Limit Engine", "source_requirement": ["FR-005"] },
    { "id": "facilitation-routing-engine", "type": "component", "label": "Facilitation Routing Engine", "source_requirement": ["FR-006"] },
    { "id": "cohort-eligibility-gating-service", "type": "component", "label": "Cohort Eligibility Gating Service", "source_requirement": ["FR-007"] },
    { "id": "metrics-reporting-pipeline", "type": "component", "label": "Metrics & Reporting Pipeline", "source_requirement": ["FR-008", "FR-009"] }
  ],
  "edges": [
    { "from": "legal-structure-validation", "to": "onboarding-attestation-service", "type": "blocks" },
    { "from": "compliance-completeness-methodology", "to": "allergen-declaration-service", "type": "blocks" },
    { "from": "external-identity-provider", "to": "onboarding-attestation-service", "type": "blocks" },
    { "from": "external-identity-provider", "to": "buyer-discovery-matching-service", "type": "blocks" },
    { "from": "external-identity-provider", "to": "traceability-record-service", "type": "blocks" },
    { "from": "external-identity-provider", "to": "allergen-declaration-service", "type": "blocks" },
    { "from": "external-identity-provider", "to": "cohort-eligibility-gating-service", "type": "blocks" },
    { "from": "onboarding-attestation-service", "to": "facilitation-routing-engine", "type": "depends-on" },
    { "from": "traceability-record-service", "to": "facilitation-routing-engine", "type": "depends-on" },
    { "from": "buyer-discovery-matching-service", "to": "facilitation-routing-engine", "type": "depends-on" },
    { "from": "cohort-eligibility-gating-service", "to": "facilitation-routing-engine", "type": "depends-on" },
    { "from": "compliance-completeness-limit-engine", "to": "facilitation-routing-engine", "type": "depends-on" },
    { "from": "allergen-declaration-service", "to": "compliance-completeness-limit-engine", "type": "depends-on" },
    { "from": "facilitation-routing-engine", "to": "metrics-reporting-pipeline", "type": "integrates-with" },
    { "from": "compliance-completeness-limit-engine", "to": "metrics-reporting-pipeline", "type": "integrates-with" }
  ],
  "cycle_check": {
    "status": "PASS",
    "cycles_found": []
  },
  "critical_path": {
    "nodes": [
      "compliance-completeness-methodology",
      "allergen-declaration-service",
      "compliance-completeness-limit-engine",
      "facilitation-routing-engine"
    ],
    "rationale": "Longest blocking chain is 3 edges (depends-on/blocks only — integrates-with excluded as non-blocking), independently verified by DFS longest-path, not just asserted. Adding external-identity-provider (kb-L1-enterprise-security's ES1 identity-boundary finding) produced a GENUINE TIE at 3 edges: external-identity-provider -> allergen-declaration-service -> compliance-completeness-limit-engine -> facilitation-routing-engine is exactly as long as the compliance-completeness-methodology chain listed in nodes above, because both external dependencies converge on the SAME entry point (allergen-declaration-service) and share its entire downstream tail. allergen-declaration-service is therefore a compounded bottleneck, blocked by two independent, unresolved external dependencies at once — resolving only one does not clear the critical path. compliance-completeness-methodology is listed first here as the pre-existing critical path (unchanged ordering, not a claim that it outranks the tied identity-provider chain). The legal-structure chain (legal-structure-validation -> onboarding-attestation-service -> facilitation-routing-engine, 2 edges) and the other three identity-provider entry chains (via onboarding-attestation-service, buyer-discovery-matching-service, traceability-record-service, or cohort-eligibility-gating-service, all 2 edges) remain one hop shorter."
  },
  "generated": "2026-08-05",
  "execution_id": "exec-4b8d6f30",
  "workflow_execution_id": "wf-6d3f8b04"
}
